{
  "cross_family_dependency_edges": 102,
  "cross_family_edges": [
    {
      "dependency_name": "@aftergraph/contracts",
      "evidence_refs": [
        "git://Aftergraph/runtime@45d1d95282ca0cb6926c49ce43847884e2eaae43/packages/identity-core/package.json"
      ],
      "source_component_id": "ag:component:identity-core",
      "source_family": "COVENANT_SUPPORT",
      "target_component_id": "ag:component:contracts",
      "target_family": "COMMONS"
    },
    {
      "dependency_name": "@aftergraph/contracts",
      "evidence_refs": [
        "git://Aftergraph/runtime@45d1d95282ca0cb6926c49ce43847884e2eaae43/packages/tenant-core/package.json"
      ],
      "source_component_id": "ag:component:tenant-core",
      "source_family": "COVENANT_SUPPORT",
      "target_component_id": "ag:component:contracts",
      "target_family": "COMMONS"
    },
    {
      "dependency_name": "@avc/contracts",
      "evidence_refs": [
        "git://Aftergraph/autonomous-venture-company@6c474b9001e445eabed0c0f5ec34f167686d7a72/packages/constitution/package.json"
      ],
      "source_component_id": "ag:legacy:avc:constitution",
      "source_family": "COVENANT_SUPPORT",
      "target_component_id": "ag:legacy:avc:contracts",
      "target_family": "COMMONS"
    },
    {
      "dependency_name": "@avc/contracts",
      "evidence_refs": [
        "git://Aftergraph/autonomous-venture-company@6c474b9001e445eabed0c0f5ec34f167686d7a72/packages/identity-core/package.json"
      ],
      "source_component_id": "ag:legacy:avc:identity-core",
      "source_family": "COVENANT_SUPPORT",
      "target_component_id": "ag:legacy:avc:contracts",
      "target_family": "COMMONS"
    },
    {
      "dependency_name": "@avc/contracts",
      "evidence_refs": [
        "git://Aftergraph/autonomous-venture-company@6c474b9001e445eabed0c0f5ec34f167686d7a72/apps/identity-worker/package.json"
      ],
      "source_component_id": "ag:legacy:avc:identity-worker",
      "source_family": "COVENANT_SUPPORT",
      "target_component_id": "ag:legacy:avc:contracts",
      "target_family": "COMMONS"
    },
    {
      "dependency_name": "@avc/contracts",
      "evidence_refs": [
        "git://Aftergraph/autonomous-venture-company@6c474b9001e445eabed0c0f5ec34f167686d7a72/packages/tenant-core/package.json"
      ],
      "source_component_id": "ag:legacy:avc:tenant-core",
      "source_family": "COVENANT_SUPPORT",
      "target_component_id": "ag:legacy:avc:contracts",
      "target_family": "COMMONS"
    },
    {
      "dependency_name": "@aftergraph/kernel-core",
      "evidence_refs": [
        "git://Aftergraph/runtime@45d1d95282ca0cb6926c49ce43847884e2eaae43/packages/constitution/package.json"
      ],
      "source_component_id": "ag:component:constitution",
      "source_family": "COVENANT_SUPPORT",
      "target_component_id": "ag:component:kernel-core",
      "target_family": "DRIVE"
    },
    {
      "dependency_name": "@avc/kernel-core",
      "evidence_refs": [
        "git://Aftergraph/autonomous-venture-company@6c474b9001e445eabed0c0f5ec34f167686d7a72/packages/constitution/package.json"
      ],
      "source_component_id": "ag:legacy:avc:constitution",
      "source_family": "COVENANT_SUPPORT",
      "target_component_id": "ag:legacy:avc:kernel-core",
      "target_family": "DRIVE"
    },
    {
      "dependency_name": "@avc/mission-graph",
      "evidence_refs": [
        "git://Aftergraph/autonomous-venture-company@6c474b9001e445eabed0c0f5ec34f167686d7a72/apps/mission-graph-authority/package.json"
      ],
      "source_component_id": "ag:legacy:avc:mission-graph-authority",
      "source_family": "COVENANT_SUPPORT",
      "target_component_id": "ag:legacy:avc:mission-graph",
      "target_family": "HELM"
    },
    {
      "dependency_name": "@avc/contracts",
      "evidence_refs": [
        "git://Aftergraph/autonomous-venture-company@6c474b9001e445eabed0c0f5ec34f167686d7a72/product-cells/leadrescue/package.json"
      ],
      "source_component_id": "ag:legacy:avc:leadrescue",
      "source_family": "DOMAIN",
      "target_component_id": "ag:legacy:avc:contracts",
      "target_family": "COMMONS"
    },
    {
      "dependency_name": "@avc/contracts",
      "evidence_refs": [
        "git://Aftergraph/autonomous-venture-company@6c474b9001e445eabed0c0f5ec34f167686d7a72/product-cells/serviceops/package.json"
      ],
      "source_component_id": "ag:legacy:avc:serviceops",
      "source_family": "DOMAIN",
      "target_component_id": "ag:legacy:avc:contracts",
      "target_family": "COMMONS"
    },
    {
      "dependency_name": "@avc/contracts",
      "evidence_refs": [
        "git://Aftergraph/autonomous-venture-company@6c474b9001e445eabed0c0f5ec34f167686d7a72/apps/serviceops-mcp/package.json"
      ],
      "source_component_id": "ag:legacy:avc:serviceops-mcp",
      "source_family": "DOMAIN",
      "target_component_id": "ag:legacy:avc:contracts",
      "target_family": "COMMONS"
    },
    {
      "dependency_name": "@avc/tenant-core",
      "evidence_refs": [
        "git://Aftergraph/autonomous-venture-company@6c474b9001e445eabed0c0f5ec34f167686d7a72/product-cells/serviceops/package.json"
      ],
      "source_component_id": "ag:legacy:avc:serviceops",
      "source_family": "DOMAIN",
      "target_component_id": "ag:legacy:avc:tenant-core",
      "target_family": "COVENANT_SUPPORT"
    },
    {
      "dependency_name": "@avc/events",
      "evidence_refs": [
        "git://Aftergraph/autonomous-venture-company@6c474b9001e445eabed0c0f5ec34f167686d7a72/product-cells/leadrescue/package.json"
      ],
      "source_component_id": "ag:legacy:avc:leadrescue",
      "source_family": "DOMAIN",
      "target_component_id": "ag:legacy:avc:events",
      "target_family": "DRIVE"
    },
    {
      "dependency_name": "@avc/kernel-core",
      "evidence_refs": [
        "git://Aftergraph/autonomous-venture-company@6c474b9001e445eabed0c0f5ec34f167686d7a72/product-cells/leadrescue/package.json"
      ],
      "source_component_id": "ag:legacy:avc:leadrescue",
      "source_family": "DOMAIN",
      "target_component_id": "ag:legacy:avc:kernel-core",
      "target_family": "DRIVE"
    },
    {
      "dependency_name": "@avc/kernel-core",
      "evidence_refs": [
        "git://Aftergraph/autonomous-venture-company@6c474b9001e445eabed0c0f5ec34f167686d7a72/product-cells/serviceops/package.json"
      ],
      "source_component_id": "ag:legacy:avc:serviceops",
      "source_family": "DOMAIN",
      "target_component_id": "ag:legacy:avc:kernel-core",
      "target_family": "DRIVE"
    },
    {
      "dependency_name": "@aftergraph/contracts",
      "evidence_refs": [
        "git://Aftergraph/runtime@45d1d95282ca0cb6926c49ce43847884e2eaae43/packages/events/package.json"
      ],
      "source_component_id": "ag:component:events",
      "source_family": "DRIVE",
      "target_component_id": "ag:component:contracts",
      "target_family": "COMMONS"
    },
    {
      "dependency_name": "@aftergraph/contracts",
      "evidence_refs": [
        "git://Aftergraph/runtime@45d1d95282ca0cb6926c49ce43847884e2eaae43/packages/job-runtime/package.json"
      ],
      "source_component_id": "ag:component:job-runtime",
      "source_family": "DRIVE",
      "target_component_id": "ag:component:contracts",
      "target_family": "COMMONS"
    },
    {
      "dependency_name": "@aftergraph/contracts",
      "evidence_refs": [
        "git://Aftergraph/runtime@45d1d95282ca0cb6926c49ce43847884e2eaae43/packages/kernel-core/package.json"
      ],
      "source_component_id": "ag:component:kernel-core",
      "source_family": "DRIVE",
      "target_component_id": "ag:component:contracts",
      "target_family": "COMMONS"
    },
    {
      "dependency_name": "@avc/contracts",
      "evidence_refs": [
        "git://Aftergraph/autonomous-venture-company@6c474b9001e445eabed0c0f5ec34f167686d7a72/apps/agent-gateway/package.json"
      ],
      "source_component_id": "ag:legacy:avc:agent-gateway",
      "source_family": "DRIVE",
      "target_component_id": "ag:legacy:avc:contracts",
      "target_family": "COMMONS"
    },
    {
      "dependency_name": "@avc/contracts",
      "evidence_refs": [
        "git://Aftergraph/autonomous-venture-company@6c474b9001e445eabed0c0f5ec34f167686d7a72/packages/company-daemon/package.json"
      ],
      "source_component_id": "ag:legacy:avc:company-daemon",
      "source_family": "DRIVE",
      "target_component_id": "ag:legacy:avc:contracts",
      "target_family": "COMMONS"
    },
    {
      "dependency_name": "@avc/contracts",
      "evidence_refs": [
        "git://Aftergraph/autonomous-venture-company@6c474b9001e445eabed0c0f5ec34f167686d7a72/packages/events/package.json"
      ],
      "source_component_id": "ag:legacy:avc:events",
      "source_family": "DRIVE",
      "target_component_id": "ag:legacy:avc:contracts",
      "target_family": "COMMONS"
    },
    {
      "dependency_name": "@avc/contracts",
      "evidence_refs": [
        "git://Aftergraph/autonomous-venture-company@6c474b9001e445eabed0c0f5ec34f167686d7a72/packages/hermes-adapter/package.json"
      ],
      "source_component_id": "ag:legacy:avc:hermes-adapter",
      "source_family": "DRIVE",
      "target_component_id": "ag:legacy:avc:contracts",
      "target_family": "COMMONS"
    },
    {
      "dependency_name": "@avc/contracts",
      "evidence_refs": [
        "git://Aftergraph/autonomous-venture-company@6c474b9001e445eabed0c0f5ec34f167686d7a72/packages/job-runtime/package.json"
      ],
      "source_component_id": "ag:legacy:avc:job-runtime",
      "source_family": "DRIVE",
      "target_component_id": "ag:legacy:avc:contracts",
      "target_family": "COMMONS"
    },
    {
      "dependency_name": "@avc/contracts",
      "evidence_refs": [
        "git://Aftergraph/autonomous-venture-company@6c474b9001e445eabed0c0f5ec34f167686d7a72/packages/kernel-core/package.json"
      ],
      "source_component_id": "ag:legacy:avc:kernel-core",